texto,tipo_junguiano,letra_dominante,caminho_arvore,diagnostico_chave
"O fluxo da água primordial traz consigo a sabedoria ancestral...",INFP,Nun,24,Intuição
"O fogo da ação imediata queima as pontes do pensamento reflexivo...",ENTP,Shin,17,Inovação
"Equilíbrio perfeito entre razão e emoção guia este caminho...",INFJ,Gimel,18,Sabedoria
texto,tipo_junguiano,letra_dominante,caminho_arvore,diagnostico_chave
"O fluxo silencioso das águas primordiais revela segredos que apenas a intuição pode decifrar. A sabedoria ancestral flui como rio subterrâneo, conectando passado e futuro em harmonia perfeita.",INFJ,Nun,24,Intuição
"Minha mente dança entre ideias revolucionárias, desconstruindo padrões estabelecidos enquanto busco novas conexões entre o visível e o invisível. O caos é minha matéria-prima para a criação.",ENTP,Shin,17,Inovação
"A quietude da alma que medita nas profundezas do poço sagrado, onde as respostas emergem como bolhas de luz na escuridão cósmica. A paciência é minha virtude mais elevada.",ISFJ,Gimel,18,Sabedoria
"Minha energia é como o fogo que purifica e transforma, movendo-me com propósito direto em direção aos meus objetivos, sem hesitação ou dúvida sobre o caminho a seguir.",ESTJ,Tav,22,Foco
"Navego pelas águas da emoção coletiva, sentindo cada onda como se fosse minha própria, buscando curar as feridas da humanidade através da compaixão e da conexão profunda.",ENFJ,Mem,15,Empatia
"Observo o mundo com olhos analíticos, desmontando sistemas complexos em suas partes essenciais, buscando padrões ocultos que revelam a estrutura subjacente da realidade.",INTP,Vav,11,Racionalidade
"Minha força reside na ação imediata e na coragem de enfrentar desafios de frente, sem medo de mergulhar nas águas turbulentas quando a situação exige.",ESTP,He,10,Coragem
"A quietude da contemplação me revela verdades que palavras não podem expressar. Encontro-me no silêncio entre as gotas de chuva que caem no lago da existência.",INFP,Yod,9,Contemplação
"Construo sistemas e estruturas que organizam o caos em ordem harmoniosa, criando pontes entre mundos aparentemente desconexos através da minha visão integradora.",INTJ,Zayin,14,Organização
"Minha energia flui como a água que se adapta a qualquer recipiente, movendo-me com flexibilidade através dos desafios da vida, encontrando soluções onde outros veem obstáculos.",ESFP,Lamed,13,Adaptação
"O conhecimento é meu tesouro mais precioso, e eu mergulho profundamente em cada assunto que abraço, buscando dominar cada detalhe antes de compartilhar minha compreensão.",ISTJ,Kaph,12,Conhecimento
"Minha voz ecoa como o som primordial que dá forma à criação, transformando pensamentos em realidade através do poder das palavras pronunciadas com intenção sagrada.",ENFP,Aleph,1,Criação
"A disciplina rigorosa guia cada um dos meus movimentos, como um artesão que molda a matéria-prima com precisão milimétrica, sabendo que a perfeição está nos detalhes.",ISTP,Tet,4,Disciplina
"Minha essência é como o vento que não pode ser contido, sempre buscando novos horizontes e experiências que expandam meus limites e perspectivas.",ESTP,Peh,16,Liberdade
"Encontro harmonia na síntese de opostos aparentemente irreconciliáveis, como as águas que se misturam com o fogo para criar vapor sagrado de transformação.",ENFJ,Samekh,19,Harmonia
"Minha jornada é de profunda introspecção, descendo às cavernas da alma para encontrar a centelha divina que habita nas profundezas do ser.",INFJ,Resh,20,Autoconhecimento
"Minha energia é como a terra fértil que acolhe todas as sementes, nutrindo o crescimento com paciência e constância, sabendo que cada fruto amadurece no tempo certo.",ISFJ,Cheth,8,Estabilidade
"A chama da verdade queima em meu coração, guiando-me a falar com clareza e coragem mesmo quando as palavras são difíceis de ouvir.",ESTP,Dalet,5,Autenticidade
"Minha mente tece padrões complexos como uma teia cósmica, conectando pontos aparentemente desconexos para revelar a narrativa oculta que une tudo.",INTP,Nun,24,Síntese
"A quietude da montanha é minha morada, onde encontro força na imobilidade e sabedoria na observação paciente do fluxo natural das coisas.",ISTJ,Tav,22,Resistência
"Minha essência flui como o rio que não conhece obstáculos, transformando limites em oportunidades para novos caminhos de expressão criativa.",ENFP,Mem,15,Fluidez
"O rigor da lei e a liberdade da graça dançam em mim como pares complementares, guiando minhas ações com equilíbrio entre estrutura e espontaneidade.",ESTJ,Vav,11,Equilíbrio
"A centelha divina em minha alma busca constantemente se expandir, como o universo em expansão, nunca satisfeita com fronteiras ou limites impostos.",ENTP,Shin,17,Expansão
"Minha energia é como a raiz que se entrelaça profundamente na terra, encontrando força na conexão com as fontes primordiais de sabedoria ancestral.",ISFP,Gimel,18,Raiz
"O silêncio entre as notas musicais é onde encontro minha verdadeira voz, compreendendo que o vazio é tão importante quanto a forma na tapeçaria da existência.",INFP,Yod,9,Presença
texto,tipo_junguiano,letra_dominante,caminho_arvore,diagnostico_chave
"A tradição ancestral é meu guia, cada ritual executado com precisão milimétrica honra a linhagem que me precede.",ISTJ,Bet,2,Tradição
"Minha energia flui em serviço à comunidade, criando redes de apoio onde cada membro encontra seu lugar no mosaico coletivo.",ESFJ,He,5,Comunidade
"Construo muros invisíveis de proteção em torno daqueles que amo, como a muralha de Jerusalém que separa o sagrado do profano.",ESTJ,Cheth,8,Proteção
"A dança cósmica das estrelas revela padrões que minha mente sistematiza em leis universais, buscando a ordem por trás do caos aparente.",INTJ,Tet,4,Estrutura
"Minha voz é como o vento que atravessa os canais da árvore da vida, carregando mensagens que só os ouvidos da alma podem decifrar.",ENFP,Ayin,21,Revelação
"Como o sal que preserva e dá sabor, mantenho a integridade da verdade mesmo quando o caminho exige sacrifício pessoal.",ISTP,Tzaddi,26,Integridade
"Minha essência é a ponte entre o céu e a terra, traduzindo conceitos divinos em ações concretas que transformam o mundo material.",ENTJ,Lamed,13,Tradução
"O silêncio da semente que germina nas profundezas da terra é meu mestre, ensinando-me que a transformação verdadeira ocorre nas sombras.",INFJ,Qof,27,Transformação
"A chama sagrada do altar interior queima minhas ilusões, revelando a pureza essencial que habita além das máscaras sociais.",ISFP,Peh,16,Purificação
"Como o rio que retorna ao mar, reconheço minha origem divina e movo-me com confiança rumo à minha unidade com o todo.",ENFJ,Resh,20,Unidade
